"ID","Gemeinde_color","Ja_Stimmen_In_Prozent","Nein_Stimmen_In_Prozent","Gemeinde_de","Text_de"
3101,54.7,54.7,45.3,"Appenzell AI","Mit 7'841 Ja zu 6'503 Nein hat sich Appenzell für die Pensionskassenreform ausgesprochen. Das entspricht einem Ja-Stimmen-Anteil von 54,7 Prozent. Damit hat in Appenzell seit der letzten Abstimmung über die berufliche Vorsorge im Jahr 2010 ein Meinungsumschwung stattgefunden: Damals hatte noch eine Mehrheit von 57,5 Prozent ein Nein in die Urne gelegt."
3102,81.4,81.4,18.6,"Gonten AI","81,4 Prozent der Stimmbürgerinnen und Stimmbürger in Gonten haben Ja gesagt zur Pensionskassenreform. Im Vergleich zur letzten Abstimmung über die berufliche Vorsorge im Jahr 2010 hat in Gonten die Zustimmung zugenommen. Damals betrug der Ja-Stimmen-Anteil 51,4 Prozent."
3104,90.1,90.1,9.9,"Schlatt-Haslen AI","Die Pensionskassenreform ist in Schlatt-Haslen mit 90,1 Prozent der Stimmen angenommen worden. Damit hat in Schlatt-Haslen seit der letzten Abstimmung über die berufliche Vorsorge im Jahr 2010 ein Meinungsumschwung stattgefunden: Damals hatte noch eine Mehrheit von 55,8 Prozent ein Nein in die Urne gelegt."
3111,61.6,61.6,38.4,"Oberegg AI","Die Pensionskassenreform ist in Oberegg mit 61,6 Prozent der Stimmen angenommen worden. Damit hat in Oberegg seit der letzten Abstimmung über die berufliche Vorsorge im Jahr 2010 ein Meinungsumschwung stattgefunden: Damals hatte noch eine Mehrheit von 71,2 Prozent ein Nein in die Urne gelegt."
3112,53.4,53.4,46.6,"Schwende-Rüti AI","Schwende-Rüti hat die Pensionskassenreform angenommen. Die Gemeinde stimmte der Vorlage mit Ja-Stimmen-Anteil von 53,4 Prozent zu. Damit hat in Schwende-Rüti seit der letzten Abstimmung über die berufliche Vorsorge im Jahr 2010 ein Meinungsumschwung stattgefunden: Damals hatte noch eine Mehrheit von 55,9 Prozent ein Nein in die Urne gelegt."
