"ID","Gemeinde_color","Ja_Stimmen_In_Prozent","Nein_Stimmen_In_Prozent","Gemeinde_de","Text_de"
3101,27.5,27.5,72.5,"Appenzell AI","72,5 Prozent der Stimmbürgerinnen und Stimmbürger von Appenzell sagen Nein zur Kostenbremse-Initiative. Appenzell hat damit gleich wie der Kanton Appenzell Innerrhoden Nein gesagt zu dieser Vorlage."
3102,25.2,25.2,74.8,"Gonten AI","Keine Mehrheit für die Kostenbremse-Initiative in Gonten: Mit 291 Nein-Stimmen zu 98 Ja-Stimmen oder 74,8 Prozent hat die Gemeinde das Volksbegehren verworfen. Gonten hat damit gleich wie der Kanton Appenzell Innerrhoden Nein gesagt zu dieser Vorlage."
3104,29.5,29.5,70.5,"Schlatt-Haslen AI","In Schlatt-Haslen hat die Stimmbevölkerung die Kostenbremse-Initiative abgelehnt. Das Volksbegehren wurde mit einem Nein-Stimmen-Anteil von 70,5 Prozent verworfen. Schlatt-Haslen hat damit gleich wie der Kanton Appenzell Innerrhoden Nein gesagt zu dieser Vorlage."
3111,34.9,34.9,65.1,"Oberegg AI","In Oberegg hat die Stimmbevölkerung die Kostenbremse-Initiative abgelehnt. Das Volksbegehren wurde mit einem Nein-Stimmen-Anteil von 65,1 Prozent verworfen."
3112,24.2,24.2,75.8,"Schwende-Rüti AI","Schwende-Rüti hat die Kostenbremse-Initiative mit 75,8 Prozent abgelehnt. Schwende-Rüti hat damit bei dieser Vorlage den höchsten Nein-Anteil im Kanton Appenzell Innerrhoden."
