"ID","Gemeinde_color","Ja_Stimmen_In_Prozent","Nein_Stimmen_In_Prozent","Gemeinde_de","Text_de"
3101,26.6,26.6,73.4,"Appenzell AI","73,4 Prozent der Stimmbürgerinnen und Stimmbürger von Appenzell haben Nein gesagt zur Biodiversitätsinitiative. Appenzell hat damit gleich wie der Kanton Appenzell Innerrhoden Nein gesagt zu dieser Vorlage."
3102,15.2,15.2,84.8,"Gonten AI","Keine Mehrheit für die Biodiversitätsinitiative in Gonten: Mit 463 Nein-Stimmen zu 83 Ja-Stimmen oder 84,8 Prozent hat die Gemeinde das Volksbegehren verworfen. Gonten hat damit gleich wie der Kanton Appenzell Innerrhoden Nein gesagt zu dieser Vorlage."
3104,39,39,61,"Schlatt-Haslen AI","In Schlatt-Haslen hat die Stimmbevölkerung die Biodiversitätsinitiative abgelehnt. Das Volksbegehren wurde mit einem Nein-Stimmen-Anteil von 61 Prozent verworfen. Schlatt-Haslen hat damit gleich wie der Kanton Appenzell Innerrhoden Nein gesagt zu dieser Vorlage."
3111,24.1,24.1,75.9,"Oberegg AI","In Oberegg hat die Stimmbevölkerung die Biodiversitätsinitiative abgelehnt. Das Volksbegehren wurde mit einem Nein-Stimmen-Anteil von 75,9 Prozent verworfen. Oberegg hat damit gleich wie der Kanton Appenzell Innerrhoden Nein gesagt zu dieser Vorlage."
3112,23.7,23.7,76.3,"Schwende-Rüti AI","Schwende-Rüti hat die Biodiversitätsinitiative mit 76,3 Prozent abgelehnt. Schwende-Rüti hat damit gleich wie der Kanton Appenzell Innerrhoden Nein gesagt zu dieser Vorlage."
