"ID","Gemeinde_color","Ja_Stimmen_In_Prozent","Nein_Stimmen_In_Prozent","Gemeinde_de","Text_de"
3101,28,28,72,"Appenzell AI","72 Prozent der Stimmbürgerinnen und Stimmbürger von Appenzell sagen Nein zur ""Stopp-Impfpflicht""-Initiative. Appenzell hat damit bei dieser Vorlage den höchsten Nein-Anteil im Kanton Appenzell Innerrhoden."
3102,29,29,71,"Gonten AI","Keine Mehrheit für die ""Stopp-Impfpflicht""-Initiative in Gonten: Mit 277 Nein-Stimmen zu 113 Ja-Stimmen oder 71 Prozent hat die Gemeinde das Volksbegehren verworfen. Gonten hat damit gleich wie der Kanton Appenzell Innerrhoden Nein gesagt zu dieser Vorlage."
3104,33,33,67,"Schlatt-Haslen AI","In Schlatt-Haslen hat die Stimmbevölkerung die ""Stopp-Impfpflicht""-Initiative abgelehnt. Das Volksbegehren wurde mit einem Nein-Stimmen-Anteil von 67 Prozent verworfen."
3111,32.8,32.8,67.2,"Oberegg AI","In Oberegg hat die Stimmbevölkerung die ""Stopp-Impfpflicht""-Initiative abgelehnt. Das Volksbegehren wurde mit einem Nein-Stimmen-Anteil von 67,2 Prozent verworfen. Oberegg hat damit gleich wie der Kanton Appenzell Innerrhoden Nein gesagt zu dieser Vorlage."
3112,30.5,30.5,69.5,"Schwende-Rüti AI","Schwende-Rüti hat die ""Stopp-Impfpflicht""-Initiative mit 69,5 Prozent abgelehnt. Schwende-Rüti hat damit gleich wie der Kanton Appenzell Innerrhoden Nein gesagt zu dieser Vorlage."
