"ID","Gemeinde_color","Ja_Stimmen_In_Prozent","Nein_Stimmen_In_Prozent","Gemeinde_de","Text_de"
1401,23.8,23.8,76.2,"Alpnach OW","Alpnach hat die Biodiversitätsinitiative mit 76,2 Prozent abgelehnt. Alpnach hat damit gleich wie der Kanton Obwalden Nein gesagt zu dieser Vorlage."
1402,25.7,25.7,74.3,"Engelberg OW","In Engelberg hat die Stimmbevölkerung die Biodiversitätsinitiative abgelehnt. Das Volksbegehren wurde mit einem Nein-Stimmen-Anteil von 74,3 Prozent verworfen. Engelberg hat damit gleich wie der Kanton Obwalden Nein gesagt zu dieser Vorlage."
1403,19.9,19.9,80.1,"Giswil OW","In Giswil hat die Stimmbevölkerung die Biodiversitätsinitiative abgelehnt. Das Volksbegehren wurde mit einem Nein-Stimmen-Anteil von 80,1 Prozent verworfen. Giswil hat damit gleich wie der Kanton Obwalden Nein gesagt zu dieser Vorlage."
1404,18.2,18.2,81.8,"Kerns OW","Keine Mehrheit für die Biodiversitätsinitiative in Kerns: Mit 2'001 Nein-Stimmen zu 445 Ja-Stimmen oder 81,8 Prozent hat die Gemeinde das Volksbegehren verworfen. Kerns hat damit gleich wie der Kanton Obwalden Nein gesagt zu dieser Vorlage."
1405,19.9,19.9,80.1,"Lungern OW","Keine Mehrheit für die Biodiversitätsinitiative in Lungern: Mit 680 Nein-Stimmen zu 169 Ja-Stimmen oder 80,1 Prozent hat die Gemeinde das Volksbegehren verworfen. Lungern hat damit gleich wie der Kanton Obwalden Nein gesagt zu dieser Vorlage."
1406,27.6,27.6,72.4,"Sachseln OW","Sachseln hat die Biodiversitätsinitiative mit 72,4 Prozent abgelehnt. Sachseln hat damit gleich wie der Kanton Obwalden Nein gesagt zu dieser Vorlage."
1407,29.6,29.6,70.4,"Sarnen OW","In Sarnen hat die Biodiversitätsinitiative keine Mehrheit gefunden. Auf 70,4 Prozent der abgegebenen Stimmzettel stand ein Nein. Sarnen hat damit gleich wie der Kanton Obwalden Nein gesagt zu dieser Vorlage."
